{
  "id": "asr-whisper-tiny",
  "name": "Whisper tiny",
  "version": "1.1.0",
  "category": "perceptual",
  "modality": "audio",
  "capability": "asr",
  "modelRef": {
    "runtime": "transformersjs",
    "model": "Xenova/whisper-tiny",
    "version": "3.0.2",
    "weightsBytes": 78643200
  },
  "resources": {
    "backend": "wasm",
    "memMB": 90,
    "expectedLatencyMs": 1200
  },
  "confidenceSemantics": "heuristic",
  "failureModes": [
    "no calibrated confidence — derived from avg_logprob when present, else a presence flag",
    "language auto-detect can be wrong on short or noisy clips",
    "weights fail to download / backend unavailable (reported as a failure event)",
    "audio is resampled to 16 kHz mono in-browser; an unsupported container can fail to decode (reported as a failure event)",
    "WebGPU (fp16) is preferred when present and falls back to wasm (int8) if it cannot initialize — int8 has higher WER"
  ],
  "output": {
    "event": "one per segment",
    "payload": "{ text: string, language: string }"
  },
  "meta": {
    "sampleRateHz": 16000,
    "size": "tiny",
    "device": "webgpu→wasm",
    "dtype": "fp16→q8"
  }
}
